{
  "schema_version": 1,
  "unit_id": "unit-3",
  "lesson_sha256": "6591ccf725f3c2427950e6e6dab61120ff098ebedf4f69feb9b008f587922a71",
  "html_path": "course/unit-3.html",
  "html_sha256": "a1ec3e16626e35673b793ef2fe03d7e5146e5a66ce659e7cb300f9b6f85413c1",
  "asset_ids": [
    "campaign-data",
    "brief-template",
    "rubric"
  ],
  "trial_context_id": "g4-cold-ai-context-20261018-a",
  "visual_decision": {
    "inputs": {
      "topic": "行銷活動成效摘要",
      "learner": "第一次獨立寫活動成效摘要的行銷同仁",
      "task": "讀 CSV、計算、判讀並寫成 Markdown",
      "content_density": "公式、實際數字與長文判讀並存",
      "primary_devices": [
        "mobile",
        "tablet",
        "desktop"
      ]
    },
    "decisions": {
      "layout_rationale": "單欄閱讀讓公式、示範與修復保持相鄰。",
      "navigation": "每頁只有清楚的上一課與下一課。",
      "typography": "繁體中文正文使用較大行距，公式使用等寬字。",
      "color": "深青色只標示連結與成果，琥珀色提供焦點外框。",
      "responsive_strategy": "窄螢幕維持單欄，表格局部水平捲動。"
    }
  },
  "content_fidelity": {
    "source_sha256": "6591ccf725f3c2427950e6e6dab61120ff098ebedf4f69feb9b008f587922a71",
    "rendered_source_sha256": "6591ccf725f3c2427950e6e6dab61120ff098ebedf4f69feb9b008f587922a71",
    "teaching_atoms": [
      "learner_outcome",
      "full_demonstration",
      "guided_practice",
      "independent_practice",
      "recovery"
    ],
    "result": "PASS"
  },
  "render": {
    "browser": "Playwright Chromium",
    "tested_at": "2026-10-18T18:40:00+08:00",
    "screenshots": [
      "evidence/unit-3-desktop.png",
      "evidence/unit-3-tablet.png",
      "evidence/unit-3-mobile.png"
    ],
    "result": "PASS"
  },
  "devices": {
    "mobile": {
      "viewport": "390x844",
      "core_path_result": "PASS",
      "horizontal_overflow": false
    },
    "tablet": {
      "viewport": "820x1180",
      "core_path_result": "PASS",
      "horizontal_overflow": false
    },
    "desktop": {
      "viewport": "1440x900",
      "core_path_result": "PASS",
      "horizontal_overflow": false
    }
  },
  "accessibility": {
    "automated": {
      "tool": "HTML landmark/link audit",
      "result": "PASS",
      "report_path": "evidence/accessibility-report.json"
    },
    "manual": {
      "evaluator_id": "course-author-ai",
      "keyboard_result": "PASS",
      "focus_result": "PASS",
      "reading_sequence_result": "PASS",
      "notes": "鍵盤依閱讀順序到 rubric、上一課與首頁，focus 清楚可見。"
    }
  },
  "navigation": {
    "entry": "course/index.html",
    "previous": "course/unit-2.html",
    "next": "course/index.html"
  }
}
